<?xml version="1.0" encoding="iso-8859-1"?>
<!DOCTYPE report PUBLIC "-//JFreeReport//DTD report definition//EN//simple"
                        "http://jfreereport.sourceforge.net/report.dtd">
<report name="missing characters" width="732" height="500" leftmargin="30" topmargin="30">
  <configuration>
    <property name="org.jfree.report.modules.output.pageable.pdf.PDFOutputTarget.default.Encoding">Identity-H</property>
    <property name="org.jfree.report.modules.output.pageable.pdf.PDFOutputTarget.default.EmbedFonts">true</property>
  </configuration>
  <reportheader fontname="Verdana" fontsize="11">
    <!-- ignored image field containing logo -->
    <rectangle x="0" y="1" width="732" height="25" color="yellow" fill="true" draw="false" />
    <label x="0" y="1" width="732" height="25" vertical-alignment="bottom" alignment="center">Client Meetings (Equities Management)</label>
    <!-- ignored image field containing logo -->

    <line x1="0" y1="30" x2="732" y2="30"/>
    <line x1="0" y1="47" x2="732" y2="47" color="red" />
    <label x="0" y="35" width="60" height="12" vertical-alignment="top">Date</label>
    <label x="65" y="35" width="125" height="12" vertical-alignment="top">Account</label>
    <label x="195" y="35" width="250" height="12" vertical-alignment="top">Details</label>
    <label x="475" y="35" width="250" height="12" vertical-alignment="top">Creator / Attendees</label>
    <line x1="0" y1="50" x2="732" y2="50"/>
    <label x="0" y="60" width="120" height="10" vertical-alignment="top" fontsize="10" fontstyle="bold">Last Week</label>
    <line x1="0" y1="173.6" x2="732" y2="173.6"/>
    <label x="0" y="80" width="60" height="10" vertical-alignment="top" fontsize="8">Wednesday</label>
    <label x="0" y="92" width="60" height="10" vertical-alignment="top" fontsize="8">Aug 27, 2003</label>
    <label x="65" y="80" width="125" height="10" vertical-alignment="top" fontsize="8">Cavalry Asset Management</label>
    <label x="195" y="80" width="265" height="104" vertical-alignment="top" fontsize="8">John Hurley Meeting - Pesce &amp; Allcroft

Post Meeting Comments: Followup from Meeting:
Schedule Tech demo with Bill and Kelly
Schedule Cap Acctg demo with Jeannette for Sept
Get hard to borrow list from Bill
Thank you's for the meeting
sample of wash sale reporting
id's/passwords for access to demo site
confirm the "angst" factor
    </label>

  </reportheader>
</report>
