<?xml version="1.0" encoding="iso-8859-1"?>
<!--
	<!DOCTYPE report SYSTEM "http://jfreereport.sourceforge.net/report.dtd">
-->
<report name="Sample Report 1" width="468" height="648">

    <reportheader height="48" fontname="Serif" fontstyle="bold" fontsize="20">
        <label name="Label 1" x="0" y="0" width="450" height="24" alignment="center" baseline="20">LIST OF COUNTRIES BY CONTINENT</label>
    </reportheader>

    <reportfooter height="48" fontname="Serif" fontstyle="bold" fontsize="16">
        <!-- insert a number field here showing the total population -->
        <label name="Label 2" x="0" y="0" width="450" height="24" alignment="center">*** END OF REPORT ***</label>
    </reportfooter>

    <pageheader height="18" fontname="Serif" fontstyle="bold" fontsize="12">
        <label name="Label 3" x="0" y="0" width="450" height="14" alignment="right">List of Countries by Continent</label>
        <line name="line1" x1="0" y1="16" x2="0" y2="16" weight="0.5"/>
    </pageheader>

    <pagefooter height="18">
        <!-- insert a page number field here -->
    </pagefooter>

    <groups>
        <group name="Continent Group">
            <groupheader height="18" fontname="Monospaced" fontstyle="bold" fontsize="9" pagebreak="false">
                <label name="Label 5" x="0" y="1" width="76" height="9" alignment="left">CONTINENT:</label>
                <string-field name="Continent Element" x="96" y="1" width="76" height="9" alignment="left" fieldname="Continent"/>
                <line name="line1" x1="0" y1="12" x2="0" y2="12" weight="0.5"/>
            </groupheader>
            <groupfooter height="18" fontname="Monospaced" fontstyle="bold" fontsize="9">
                <label name="Label 6" x="0" y="0" width="450" height="12" alignment="left" baseline="10">Population:</label>
                <number-function x="240" y="0" width="76" height="8" alignment="right" baseline="10" format="#,##0" function="sum"/>
            </groupfooter>
            <fields>
                 <field>Continent</field>
            </fields>
        </group>
    </groups>

    <items height="10" fontname="Monospaced" fontstyle="plain" fontsize="8">
        <string-field name="Country Element" x="0" y="0" width="76" height="8" alignment="left" fieldname="Country" />
        <string-field name="Code Element" x="180" y="0" width="76" height="8" alignment="left" fieldname="ISO Code"/>
        <number-field name="Population Element" x="240" y="0" width="76" height="8" alignment="right" format="#,##0" fieldname="Population"/>
    </items>

    <functions>
      <function name="sum" class="com.jrefinery.report.function.ItemSumFunction">
			  <properties>
				  <property name="field">Population</property>
					<property name="group">Continent Group</property>
				</properties>
			</function>
    </functions>
</report>
