<?xml version="1.0" encoding="iso-8859-1"?>
<!DOCTYPE report SYSTEM "http://jfreereport.sourceforge.net/report.dtd">
<!--
<report name="Country Report" pageformat="A4">

  <reportheader height="90" fontname="SansSerif" fontstyle="bold" fontsize="18">
    <label name="label Title" x="0" y="0" width="100%" height="20" alignment="center">List of Countries</label>
    <label name="label SubTitle" x="0" y="24" width="100%" height="10" fontsize="10" alignment="center">Belmarine Confidential</label>
    <imageref x="10" y="10" width="75" height="13" src="logo.gif" name="logo"/>
  </reportheader>

  <reportfooter height="24" fontname="SansSerif" fontstyle="bold" fontsize="10">
    <label name="label Footer" x="0" y="0" width="100%" height="20" alignment="center">END OF REPORT</label>
  </reportfooter>

  <pageheader height="18" fontname="Serif" fontstyle="bold" fontsize="9" alignment="left" onfirstpage="false">
    <label name="Label Id" x="0" y="0" width="20" height="9" fontstyle="italic">Id</label>
    <label name="Label Name" x="25" y="0" width="150" height="9" fontstyle="italic">Name</label>
    <label name="Label Rank" x="180" y="0" width="20" height="9" fontstyle="italic" alignment="right">Balance Rank</label>
    <line name="line1" x1="0" y1="12" x2="0" y2="12" weight="0.5"/>
  </pageheader>

  <pagefooter height="24" onfirstpage="true" onlastpage="true" fontname="Serif" fontstyle="italic" fontsize="8">
    <line name="line2" x1="0" y1="4" x2="0" y2="4" weight="0.5"></line>
    <label name="label copyright" x="0" y="4" width="100" height="18" alignment="left">© Insurance Data S.A.</label>
    <number-field name="pagenum1" fieldname="PageNumber" format="Page 0" x="0" y="4" width="100%" height="18" alignment="center"/>
    <date-field name="date1" fieldname="report.date" format="d-MMM-yyyy" x="0" y="4" width="100%" height="18" alignment="right"/>
  </pagefooter>

  <groups>
    <group name="AccDate Group">
      <groupheader height="18" fontname="Serif" fontstyle="bold" fontsize="9" alignment="left" pagebreak="true">
        <label name="Label Id" x="0" y="0" width="20" height="9" fontstyle="italic">Id</label>
        <label name="Label Name" x="25" y="0" width="150" height="9" fontstyle="italic">Name</label>
        <label name="Label Rank" x="180" y="0" width="20" height="9" fontstyle="italic" alignment="right">Balance Rank</label>
        <line name="line1" x1="0" y1="12" x2="0" y2="12" weight="0.5"/>
      </groupheader>
      <fields>
        <field>GroupNumber</field>
      </fields>
    </group>
  </groups>

  <items height="10" fontname="Monospaced" fontstyle="plain" fontsize="8">
    <rectangle name="background" x="0" y="0" width="100%" height="100%" color="#DFDFDF" weight="0"/>
    <line name="top" x1="0" y1="0" x2="0" y2="0" color="#DFDFDF" weight="0.1"/>
    <line name="bottom" x1="0" y1="10" x2="0" y2="10" color="#DFDFDF" weight="0.1"/>
    <string-field name="Id Element" x="0" y="0" width="20" height="8" alignment="left" fieldname="Country Id"/>
    <string-field name="Name Element" x="25" y="0" width="150" height="8" alignment="left" fieldname="Name"/>
    <number-field name="Rank Element" x="180" y="0" width="20" height="8" alignment="right" format="# ###" fieldname="Balance Rank"/>
  </items>

  <functions>
    <function name="PageNumber" class="org.jfree.report.function.PageFunction"/>
    <property-ref name="report.date"/>
    <function name="backgroundTrigger" class="org.jfree.report.function.ElementVisibilitySwitchFunction">
      <properties>
        <property name="element">background</property>
      </properties>
    </function>
  </functions>
</report>
-->

<report name="Sample Report 2" pageformat="A4" topmargin="70" leftmargin="70" bottommargin="70" rightmargin="70">

  <reportfooter height="24" fontname="SansSerif" fontstyle="bold" fontsize="10" ownpage="true">
    <label x="0" y="0" width="100%" height="20" alignment="center">END OF REPORT</label>
  </reportfooter>

  <pageheader height="32" onfirstpage="true" fontname="Serif" fontstyle="bold" fontsize="10">
    <line x1="0" y1="30" x2="0" y2="30" weight="0.5"/>
    <label x="0" y="12" width="100%" height="20" alignment="center">PAGE HEADER</label>
    <string-field x="0" y="0" width="140" height="8" alignment="left" fieldname="Name"/>
    <number-field x="110" y="0" width="40" height="8" alignment="right" format="0" fieldname="Count1"/>
  </pageheader>

  <pagefooter height="24" onfirstpage="true" onlastpage="true" fontname="Serif" fontstyle="plain" fontsize="9">
    <line x1="0" y1="4" x2="0" y2="4" weight="0.5"/>
    <date-field fieldname="report.date" format="d-MMM-yyyy" x="0" y="4" width="100" height="18" alignment="left"/>
    <string-field fieldname="pageXofY" x="0" y="4" width="100%" height="18" alignment="right"/>
  </pagefooter>

  <groups>

    <group name="Letter Group">

      <groupheader height="20" fontname="Monospaced" fontstyle="bold" fontsize="9" pagebreak="true" repeat="true">
        <label x="0" y="1" width="120" height="9" alignment="left">LETTER GROUP:</label>
        <string-field x="120" y="1" width="76" height="9" alignment="left" fieldname="Letter"/>
        <line x1="0" y1="12" x2="0" y2="12" weight="0.25"/>
        <line x1="0" y1="14" x2="0" y2="14" weight="0.25"/>
      </groupheader>

      <groupfooter height="18" fontname="Monospaced" fontstyle="bold" fontsize="9">
        <label x="0" y="2" width="100%" height="12" alignment="left">Total for letter:</label>
        <number-field fieldname="Sum2" format="#,##0.00" x="276" y="2" width="176" height="12" alignment="right"/>
      </groupfooter>

      <fields>
        <field>Letter</field>
      </fields>

    </group>

    <group name="Color Group">

      <groupheader height="18" fontname="Monospaced" fontstyle="bold" fontsize="9">
        <label x="0" y="1" width="120" height="9" alignment="left">Color Group:</label>
        <string-field x="124" y="1" width="76" height="9" alignment="left" fieldname="Color"/>
        <line x1="0" y1="12" x2="0" y2="12" weight="0.25"/>
      </groupheader>

      <groupfooter height="18" fontname="Monospaced" fontstyle="bold" fontsize="9">
        <line x1="0" y1="1" x2="0" y2="1" weight="0.25"/>
        <label x="0" y="3" width="150" height="12" alignment="left">Subtotal for color:</label>
        <number-field fieldname="Sum1" format="#,##0.00" x="276" y="3" width="176" height="12" alignment="right"/>
      </groupfooter>

      <fields>
        <field>Letter</field>
        <field>Color</field>
      </fields>
    </group>
  </groups>

  <items height="10" fontname="Monospaced" fontstyle="plain" fontsize="8">
    <string-field name="background" x="0" y="0" width="110" height="8" alignment="left" fieldname="Name"/>
    <number-field x="110" y="0" width="40" height="8" alignment="right" format="0" fieldname="Count1"/>
    <string-field x="210" y="0" width="60" height="8" alignment="left" fieldname="Letter"/>
    <string-field x="270" y="0" width="40" height="8" alignment="left" fieldname="Color"/>
    <number-field x="310" y="0" width="66" height="8" alignment="right" format="#,##0" fieldname="Integer"/>
    <number-field x="376" y="0" width="76" height="8" alignment="right" format="#,##0.00" fieldname="Double"/>
  </items>

  <functions>
    <property-ref name="report.date"/>

    <function name="Count1" class="org.jfree.report.function.ItemCountFunction">
      <properties>
        <property name="group">Color Group</property>
      </properties>
    </function>

    <function name="Count2" class="org.jfree.report.function.ItemCountFunction">
      <properties>
        <property name="group">Letter Group</property>
      </properties>
    </function>
    <function name="Sum1" class="org.jfree.report.function.TotalGroupSumFunction">
      <properties>
        <property name="field">Double</property>
        <property name="group">Color Group</property>
      </properties>
    </function>
    <function name="Sum2" class="org.jfree.report.function.TotalGroupSumFunction">
      <properties>
        <property name="field">Double</property>
        <property name="group">Letter Group</property>
      </properties>
    </function>
    <function name="PageNumber" class="org.jfree.report.function.PageFunction"/>
    <function name="PageTotal" class="org.jfree.report.function.PageTotalFunction"/>
    <expression name="pageXofY" class="org.jfree.report.function.TextFormatExpression">
      <properties>
        <property name="pattern">Page {0} of {1}</property>
        <property name="0">PageNumber</property>
        <property name="1">PageTotal</property>
      </properties>
    </expression>

    <function name="backgroundTrigger" class="org.jfree.report.function.ElementVisibilitySwitchFunction">
      <properties>
        <property name="element">background</property>
      </properties>
    </function>
  </functions>

</report>
