<?xml version="1.0" encoding="iso-8859-1"?>
<!DOCTYPE report PUBLIC "-//JFreeReport//DTD report definition//EN//simple"
                        "http://jfreereport.sourceforge.net/report.dtd">
<report name="Sample Report 2" pageformat="A4" topmargin="10" leftmargin="10" bottommargin="10" rightmargin="10">
  <reportheader height="10" fontname="Times New Roman" fontstyle="plain" fontsize="10" ownpage="true">
    <line x1="0" y1="0" x2="500" y2="0" weight="0.5" color="black"/>
    <line x1="500" y1="0" x2="500" y2="20" weight="0.5" color="black"/>
    <label x="0" y="0" width="76" height="10" alignment="left" dynamic="false">126000 thousand people</label>
  </reportheader>

  <reportfooter height="10" fontname="Times New Roman" fontstyle="plain" fontsize="10" ownpage="true">
    <line x1="0" y1="0" x2="500" y2="0" weight="0.5" color="black"/>
    <line x1="500" y1="0" x2="500" y2="20" weight="0.5" color="black"/>
    <label x="0" y="0" width="500" height="20" alignment="left" dynamic="false">This is a test. It will check to see if word wrapping is working correctly or not. If it does not work some of the words will be broken in the middle and some of them will be missing all together.</label>
  </reportfooter>

</report>
<!--
This is a test. It will check to see if word wrapping is working correctly or not. If it does not work some of the words will be broken in the middle and some of them will be missing all together.
This is a test. It will check to see if word wrapping is working correctly or not. If it does not work some of the words will be
-->
